Top queries,Clicks,Impressions,CTR,Position
conditions to marry a second wife in islam,485,9551,5.08%,3.82
rent agreement,456,22879,1.99%,8.39
rent agreement format,411,20503,2%,7.72
do i have 30 days to move after an eviction,303,8270,3.66%,6.19
esahayak,288,422,68.25%,1
marriage certificate online karnataka,284,4268,6.65%,6.23
fake offer letter download,268,676,39.64%,1.46
rental agreement,246,17804,1.38%,8.32
fake offer letter,228,2373,9.61%,5.48
fake experience certificate,217,3962,5.48%,7.52
offer letter generator,215,1582,13.59%,3.34
create offer letter online,213,929,22.93%,2.61
rent agreement online,206,7041,2.93%,9.34
online experience certificate maker,204,770,26.49%,3.28
make experience letter online,204,381,53.54%,1.03
experience certificate online,202,423,47.75%,1.26
online experience certificate,201,486,41.36%,1.2
fake experience certificate maker,198,530,37.36%,1.31
do you have 30 days after eviction notice,194,4333,4.48%,6.16
rental agreement format,191,11811,1.62%,5.07
create experience letter online,183,713,25.67%,1.04
create experience certificate online,183,364,50.27%,1.44
rental agreement format telangana,182,798,22.81%,2.03
fake experience certificate online,180,424,42.45%,1.01
experience letter maker,178,501,35.53%,1.08
marriage certificate punjab,172,7408,2.32%,6.06
relieving letter,166,109844,0.15%,1.38
legal notice for cheque bounce format pdf,163,1402,11.63%,4.7
marriage certificate online,154,9021,1.71%,12.45
offer letter format online maker,149,880,16.93%,2.31
experience letter online,139,249,55.82%,1
second marriage without divorce,138,2548,5.42%,3.17
experience letter generator,137,219,62.56%,1
relieving letter and experience letter,136,1939,7.01%,2.35
experience certificate online maker,132,339,38.94%,2.54
form 25 rto online filing,131,677,19.35%,2.64
experience certificate,128,31775,0.4%,6.26
fake job offer letter pdf,128,627,20.41%,3.27
consumer court legal notice format pdf,123,236,52.12%,1.68
indian law for second marriage without divorce,121,2078,5.82%,2.99
experience certificate maker,121,562,21.53%,3.92
how to make experience certificate,118,2105,5.61%,4.42
obc certificate,117,2378,4.92%,6.77
rental agreement online,116,4676,2.48%,8.88
divorce petition,115,2830,4.06%,3.94
online experience letter maker,113,386,29.27%,1
offer letter maker,112,648,17.28%,3.36
download rent agreement online,112,513,21.83%,3.91
fake offer letter pdf,109,324,33.64%,1.4
rent agreement format in gujarati,108,940,11.49%,6.42
how to file for divorce in india,107,2615,4.09%,5.46
bhada karar gujarati format in word,107,252,42.46%,2.93
relieving letter format,106,10603,1%,5.22
online rent agreement,103,3294,3.13%,10.48
obc certificate eligibility in andhra pradesh,102,322,31.68%,1.26
how to get marriage certificate,101,1168,8.65%,11.77
marriage certificate odisha,97,4115,2.36%,8.35
rent agreement online gujarat,96,308,31.17%,1.02
fake experience letter,94,746,12.6%,5.2
how to create fake experience certificate,94,220,42.73%,1.15
relieving letter vs experience letter,93,951,9.78%,2.36
how to file divorce in india,92,2924,3.15%,5.29
is relieving letter and experience letter same,92,1729,5.32%,2.79
divorce process in india,90,7611,1.18%,9.68
create fake experience certificate,90,164,54.88%,1.03
how to make fake experience certificate,89,506,17.59%,3.86
difference between relieving letter and experience letter,88,931,9.45%,2.93
fake joining letter generator,88,376,23.4%,2.71
rent agreement maharashtra pdf,88,254,34.65%,2.01
land lease agreement,87,3123,2.79%,12.25
partnership firm registration fees,87,1244,6.99%,4.24
how to get marriage certificate online,86,1406,6.12%,18.57
make offer letter online,86,390,22.05%,2.47
fake offer letter generator,84,438,19.18%,3.12
relieving letter and experience letter are same,81,1146,7.07%,2.89
second marriage in islam without permission of first wife,79,1662,4.75%,3.54
can a 17 year old fly alone without parents permission,79,910,8.68%,3.14
unregistered will,79,568,13.91%,4.37
legal notice for defective goods,78,1067,7.31%,8.46
how to make experience letter,78,974,8.01%,3.56
experience letter,77,16975,0.45%,10.31
fake appointment letter,77,928,8.3%,4.85
vehicle sale agreement pdf download,76,619,12.28%,4.16
relieving letter format pdf,74,3138,2.36%,7.91
will registration charges,74,787,9.4%,4.93
create experience letter online free,74,215,34.42%,1.06
how to apply for divorce in india,73,4143,1.76%,6.63
birth certificate uttarakhand,73,2792,2.61%,8.72
fake joining letter pdf,73,575,12.7%,2.9
experience certificate maker online free,70,475,14.74%,4.48
generate offer letter online,70,358,19.55%,2.65
how to make experience certificate online,70,269,26.02%,2.06
marriage registration in punjab,69,2108,3.27%,7.95
token money agreement format pdf,69,431,16.01%,2.03
how to create experience certificate,68,565,12.04%,3.52
rent deed format punjab,68,212,32.08%,2.46
generate experience letter online,65,105,61.9%,1.04
create experience certificate online free,64,238,26.89%,2.36
make experience certificate online free,64,225,28.44%,2.56
experience letter format,63,4018,1.57%,16.15
marriage registration online karnataka,63,1234,5.11%,6.31
online marriage registration karnataka,63,1043,6.04%,6.34
how to get experience certificate,63,1040,6.06%,5.13
create fake job offer letter,63,279,22.58%,2.29
e sahayak,63,137,45.99%,1.14
marriage certificate,62,7458,0.83%,13.84
rental agreement kerala,61,516,11.82%,2.85
experience certificate generator,61,151,40.4%,2.21
fake job offer letter,60,943,6.36%,6.76
rent agreement in punjab,60,306,19.61%,2.67
rent agreement format punjab pdf,60,152,39.47%,1.43
andhra pradesh rental agreement pdf,59,149,39.6%,1.15
experience letter maker free,59,121,48.76%,1.17
experience letter create online,58,95,61.05%,1
shop rental agreement format pdf,57,760,7.5%,7.89
rent agreement chandigarh,57,340,16.76%,1.21
मृत्यु के बाद वसीयत की वैधता,56,3541,1.58%,7.81
birth certificate chandigarh,56,1449,3.86%,7.07
create relieving letter online free,55,103,53.4%,1.13
supreme court judgement on unregistered will,54,1400,3.86%,7.91
rental agreement hyderabad,54,905,5.97%,4.99
second marriage in islam,54,848,6.37%,3.32
offer letter creator,54,354,15.25%,3.23
alternative for relieving letter,54,336,16.07%,2.92
obc certificate eligibility,54,315,17.14%,4.66
online offer letter maker free,54,284,19.01%,2.93
consumer legal notice format pdf,53,104,50.96%,1.88
how to get divorce in india,52,3713,1.4%,6.21
experience letter and relieving letter,52,765,6.8%,2.74
vehicle sale agreement word format india,52,724,7.18%,8.36
land sale agreement format pdf,52,715,7.27%,8.24
online offer letter maker,52,255,20.39%,2.95
make experience certificate,52,137,37.96%,1.63
experience and relieving letter,51,1642,3.11%,2.83
how to download rent agreement online,51,297,17.17%,4.57
types of will under indian succession act,51,199,25.63%,3.12
how to make experience letter online,51,127,40.16%,1.57
vehicle sale agreement,50,2558,1.95%,18.24
online rent agreement government website,50,1066,4.69%,8.4
punjab marriage registration online,50,1031,4.85%,5.66
vehicle sale agreement format,50,946,5.29%,7.51
without divorce second marriage,50,577,8.67%,2.86
free offer letter generator,50,412,12.14%,3.42
unregistered will is valid or not,50,350,14.29%,2.92
fake job offer letter generator,50,329,15.2%,3.45
online appointment letter maker free,50,201,24.88%,2.72
make experience certificate online,50,86,58.14%,1.29
मुख्तारनामा का प्रारूप pdf,49,1147,4.27%,9.37
obc certificate download,49,684,7.16%,19.86
how to make marriage certificate,49,683,7.17%,33.57
offer letter online maker,49,211,23.22%,2.68
ભાડા કરાર word,49,200,24.5%,2.08
house rent agreement format,48,1493,3.22%,11.32
land sale agreement,48,1057,4.54%,8.98
kinds of will under indian succession act,48,271,17.71%,2.14
create fake offer letter,48,241,19.92%,2.78
offer letter create online,48,160,30%,2.16
create experience certificate,48,108,44.44%,1.24
how to get divorce in india from wife,47,1869,2.51%,5.02
marriage certificate karnataka,47,1756,2.68%,7.7
unregistered will validity,47,354,13.28%,2.9
bhada karar gujarati format,47,237,19.83%,3.38
how to apply for marriage certificate,46,1002,4.59%,21.97
offer letter online,46,229,20.09%,2.27
rent agreement format uttar pradesh,46,88,52.27%,1.12
karnataka marriage certificate,45,2022,2.23%,7.91
create fake interview call letter,45,227,19.82%,3
experience certificate make online,45,74,60.81%,1.09
rent agreement online maharashtra,44,4376,1.01%,8.02
haryana resident certificate,44,2986,1.47%,9.7
online rental agreement,44,2384,1.85%,12.1
unregistered will is valid,44,373,11.8%,3.46
divorce procedure in india,43,4265,1.01%,9.4
rent agreement generator,43,518,8.3%,4.34
rent agreement download,43,325,13.23%,7.45
can a married woman marry another man without divorce in islam,43,284,15.14%,2.6
online rent agreement uttar pradesh,43,152,28.29%,2.03
consumer court legal notice format pdf in hindi,43,152,28.29%,3.38
work experience certificate online,43,97,44.33%,1.32
stamp paper for rent agreement,42,803,5.23%,9.23
experience letter vs relieving letter,42,499,8.42%,2.42
vehicle sale letter word format pdf,42,285,14.74%,6.01
bmc marriage certificate,41,3205,1.28%,6.52
do i have to tell my wife about my 2nd wife in islam,41,926,4.43%,6.2
offer letter maker free,41,258,15.89%,3.42
online marriage registration punjab,40,502,7.97%,5.46
validity of will in india,40,201,19.9%,2.58
experience certificate create online,40,74,54.05%,1.04
experience certificate format online,40,59,67.8%,1.14
how to apply for divorce,39,6216,0.63%,11.48
what is the time limit to challenge a will in india,39,552,7.07%,4
sale deed format for vehicle pdf,39,397,9.82%,5.11
create fake rent agreement online,39,319,12.23%,2.65
time limit to challenge a will in india,39,278,14.03%,3.67
bhada karar gujarati format pdf,39,274,14.23%,5.7
fake relieving letter,39,264,14.77%,2.43
create job offer letter online free,39,229,17.03%,2.71
legal notice for consumer complaint,39,192,20.31%,5.31
how to make offer letter online,39,175,22.29%,1.77
rent agreement format maharashtra,39,165,23.64%,2.78
rent agreement download pune,39,128,30.47%,2.84
online rent agreement government website gujarat,39,98,39.8%,1
experience letter maker online free,39,84,46.43%,1.02
car sale agreement format,38,987,3.85%,8.49
vehicle sale deed format,38,824,4.61%,6.93
difference between experience letter and relieving letter,38,471,8.07%,2.8
fake joining letter,38,372,10.22%,3.67
validity of registered will after death,38,331,11.48%,2.92
vehicle sale letter pdf free download,38,279,13.62%,7.31
create offer letter online free,38,224,16.96%,3.34
rent agreement rajasthan,38,155,24.52%,1.42
make experience letter online free,38,101,37.62%,1.06
experience certificate create,38,77,49.35%,1.48
can a 17 year old fly alone internationally,37,3755,0.99%,8.63
marriage certificate uttarakhand,37,2193,1.69%,7.33
create rent agreement online,37,964,3.84%,7.41
karnataka marriage certificate online,37,456,8.11%,6.42
create work experience certificate online,37,305,12.13%,2.01
fake internship offer letter,37,214,17.29%,5.61
download registered rent agreement,37,154,24.03%,3.65
how to make a fake job offer letter,37,138,26.81%,3.3
kaveri online marriage certificate,36,709,5.08%,5.57
how much does it cost to file an affidavit of heirship in texas,36,696,5.17%,3.46
requirements of a valid will in india,36,380,9.47%,3.21
validity of a will indian law,36,287,12.54%,2.83
experience letter format online,36,57,63.16%,1.02
how to file divorce,35,5239,0.67%,9.61
sale letter for vehicle pdf,35,909,3.85%,9.74
marriage certificate online odisha,35,651,5.38%,6.41
marriage certificate apply online odisha,35,326,10.74%,5.31
rent agreement in kolkata,35,318,11.01%,3.98
punjab marriage certificate online,35,259,13.51%,3.63
how to make fake offer letter,35,234,14.96%,3.64
how to create experience letter,35,209,16.75%,2.2
how to apply for marriage certificate in uttarakhand,35,162,21.6%,3.21
rent agreement mumbai pdf,35,145,24.14%,3.01
create joining letter,35,117,29.91%,1.6
tenancy agreement format west bengal,35,115,30.43%,3.15
online experience letter,35,78,44.87%,1.01
experience letter online maker,35,66,53.03%,1
domicile certificate haryana online apply,34,495,6.87%,5.76
fake offer letter generator free,34,240,14.17%,3.38
bhada karar online,34,220,15.45%,4.38
how to make fake experience letter,34,136,25%,2.82
make fake experience certificate,34,87,39.08%,1.53
relieving letter online,34,54,62.96%,1
rent agreement format pdf,33,2671,1.24%,8.06
is experience letter and relieving letter the same,33,561,5.88%,2.83
experience letter and relieving letter are same,33,534,6.18%,2.9
validity of registered will,33,378,8.73%,3
is unregistered will valid,33,316,10.44%,3.24
how to make caste certificate,33,287,11.5%,6.11
how to create fake offer letter,33,171,19.3%,2.43
create appointment letter online,33,104,31.73%,1.45
maharashtra rent agreement format,33,95,34.74%,3.07
edit experience letter online,33,60,55%,1.03
relieving letter generator,33,52,63.46%,1.02
car lease agreement,32,756,4.23%,24.08
relieving and experience letter,32,750,4.27%,2.69
"what is the process of divorce or the rules for taking divorce in india? 
explain.",32,597,5.36%,5.47
partnership deed registration fees,32,562,5.69%,6.05
rent agreement indore,32,384,8.33%,4.68
rent agreement in gujarati,32,273,11.72%,5.14
west bengal rent agreement,32,97,32.99%,1.99
how to make rent agreement,31,1207,2.57%,10.09
can a will be challenged after 12 years,31,608,5.1%,5.82
will registration fees,31,450,6.89%,4.36
flipkart offer letter pdf,31,176,17.61%,1.83
rent agreement mohali,31,176,17.61%,3.03
online experience letter maker free,31,57,54.39%,1.07
haryana domicile certificate,30,2147,1.4%,10.53
income certificate validity,30,1729,1.74%,5.72
second wife in islam position and rights,30,1279,2.35%,7.44
fake rent agreement generator,30,329,9.12%,2.85
create offer letter online india,30,157,19.11%,2.21
rent agreement format kerala,30,142,21.13%,3.39
how to apply for central caste certificate,30,140,21.43%,5.41
fake call letter generator,30,123,24.39%,2.76
online joining letter maker,30,103,29.13%,2.5
rent agreement format in madhya pradesh,30,63,47.62%,1.25
marriage certificate jharkhand,29,1542,1.88%,8.44
offer letter check online,29,1192,2.43%,6.63
punjab marriage certificate,29,1184,2.45%,6.23
bike sale agreement,29,849,3.42%,8.04
how to apply marriage certificate,29,441,6.58%,19.05
create offer letter,29,290,10%,5.25
gujarat rent agreement pdf,29,208,13.94%,3.79
appointment letter generator,29,151,19.21%,3.01
appointment letter online,29,130,22.31%,3.01
vasiyat registration fees,29,117,24.79%,1
rent agreement gujarat,29,79,36.71%,1
how to file a divorce,28,4097,0.68%,9.35
rent agreement online free,28,1241,2.26%,6.42
obc certificate ap,28,784,3.57%,8.2
caste certificate uttarakhand,28,722,3.88%,6.23
create rent agreement online free,28,654,4.28%,5.31
2nd marriage in islam,28,492,5.69%,3.68
rent agreement stamp paper value,28,410,6.83%,3.92
rent agreement pdf,28,409,6.85%,11.55
how to create offer letter,28,370,7.57%,5.22
documents required for will in india,28,363,7.71%,3.27
token receipt format,28,284,9.86%,2.83
fake rent agreement online,28,214,13.08%,2.61
rent agreement in jaipur,28,190,14.74%,3.86
make fake offer letter online,28,155,18.06%,2.14
fake interview call letter generator,28,145,19.31%,2.38
property token money receipt format,28,145,19.31%,2.46
how to make fake relieving letter,28,92,30.43%,1.84
online rent agreement haryana,28,88,31.82%,1.48
work experience letter pdf,27,1403,1.92%,9.95
types of partnership deed,27,1217,2.22%,5.44
make rent agreement online,27,841,3.21%,8.66
partnership registration fees,27,389,6.94%,3.66
vehicle sale agreement in tamil pdf,27,282,9.57%,7.27
11-month rental agreement stamp paper value in rajasthan,27,225,12%,1.02
how to get experience certificate online,27,209,12.92%,2.4
appointment letter maker,27,172,15.7%,3.06
rent agreement uttar pradesh,27,120,22.5%,1.96
joining letter maker,27,116,23.28%,2.7
rent agreement online download,27,98,27.55%,3.21
how to make marriage certificate in uttarakhand,27,90,30%,2.99
rent agreement rules in gujarat,27,88,30.68%,1.02
rent agreement format kolkata,27,83,32.53%,2.47
house rent agreement,26,1020,2.55%,11.96
online marriage certificate karnataka,26,474,5.49%,6.32
is power of attorney valid after death india,26,439,5.92%,5.99
download birth certificate online chandigarh,26,393,6.62%,5.84
vehicle sale affidavit pdf download,26,334,7.78%,8.18
2nd marriage without divorce in india,26,316,8.23%,2.91
token money receipt format,26,210,12.38%,2.97
offer letter generator free,26,148,17.57%,3.37
offer letter making online,26,131,19.85%,2.08
registered rent agreement download,26,114,22.81%,3.13
gujarati rent agreement format,26,74,35.14%,4.78
భూమి విక్రయ పత్రం pdf download,26,59,44.07%,2
marriage certificate mumbai,25,3633,0.69%,11.12
rental agreement format pdf,25,1808,1.38%,6.71
how to file a divorce in india,25,761,3.29%,5.26
power of attorney new rules in india,25,643,3.89%,8.73
first wife vs second wife in islam,25,601,4.16%,6.56
relieving letter format pdf download,25,509,4.91%,8.37
used car sale agreement pdf,25,423,5.91%,7.94
birth certificate download chandigarh,25,412,6.07%,6.83
property rights of wife after divorce in india,25,390,6.41%,3.86
rental agreement telangana,25,350,7.14%,4.87
haryana rent agreement,25,149,16.78%,2.44
online rent agreement rajasthan,25,118,21.19%,1.68
kerala rental agreement,25,92,27.17%,2.24
e rent agreement up,25,85,29.41%,1.86
how to edit relieving letter,25,74,33.78%,1
experience certificate online free,25,71,35.21%,2.08
experience letter creator,25,51,49.02%,1.1
divorce in india,24,1738,1.38%,15.57
offer letter pdf,24,804,2.99%,11.3
वसीयत कितने प्रकार की होती है,24,746,3.22%,6.79
punishment for second marriage without divorce,24,556,4.32%,4.18
marriage certificate punjab online,24,529,4.54%,6.27
without divorce second marriage possible,24,474,5.06%,2.98
rights of first wife in islam,24,407,5.9%,5.81
online offer letter,24,327,7.34%,6.08
fake work experience generator,24,195,12.31%,5.66
fake appointment letter generator,24,163,14.72%,2.65
घटस्फोट न घेता दुसरे लग्न,24,119,20.17%,2.95
fake job letter generator,24,117,20.51%,2.86
online job offer letter maker,24,87,27.59%,2.1
how to make a fake experience certificate,24,85,28.24%,3.14
online rent agreement gujarat,24,68,35.29%,1
rent agreement online rajasthan,24,68,35.29%,1.94
rent agreement format in west bengal,24,66,36.36%,1.85
how to apply divorce,23,5415,0.42%,9.74
domicile certificate haryana,23,2244,1.02%,10.07
rental agreement in tamil,23,1282,1.79%,5.05
marriage certificate haryana,23,1208,1.9%,9.69
birth certificate punjab online apply,23,1018,2.26%,11.06
how to get a divorce in india,23,724,3.18%,5
odisha marriage certificate online,23,585,3.93%,6.67
firm registration fees,23,580,3.97%,4.57
fake work experience certificate,23,516,4.46%,8.37
land lease agreement terms and conditions,23,314,7.32%,4.73
marriage without divorce,23,298,7.72%,3.87
apply marriage certificate online punjab,23,284,8.1%,5.74
how to make a experience certificate,23,278,8.27%,3.76
get experience certificate,23,246,9.35%,3.83
partnership deed online,23,229,10.04%,4.93
how to prove unregistered will,23,204,11.27%,2.9
indian law for second marriage without divorce in muslim,23,187,12.3%,3.13
online rent agreement kolkata,23,183,12.57%,3.52
rent agreement pdf download,23,174,13.22%,7.67
offer letter maker online free,23,121,19.01%,2.79
token receipt for sale of property,23,94,24.47%,3.45
online rent agreement download,23,79,29.11%,3.28
online offer letter generator,23,78,29.49%,3.01
esahayak.io,23,53,43.4%,1
wasiyat,22,1903,1.16%,4.79
rent agreement stamp paper,22,1085,2.03%,6.32
मुस्लिम दूसरी शादी करने पर क्या सजा होती है,22,667,3.3%,11.84
how to register marriage in punjab,22,522,4.21%,6.9
online marriage certificate odisha,22,445,4.94%,7.31
how to make caste certificate in up,22,436,5.05%,5.41
marriage certificate fees in haryana,22,341,6.45%,4.53
create experience letter,22,263,8.37%,2.24
offer letter editor,22,214,10.28%,4.68
जाति प्रमाण पत्र,22,179,12.29%,3.67
rental agreement format kerala,22,132,16.67%,3.95
create a offer letter,22,131,16.79%,3.98
rent agreement format in gujarati word file,22,118,18.64%,6.82
online rent agreement vadodara,22,112,19.64%,3.68
make job offer letter online,22,94,23.4%,2.23
rent agreement online up,22,83,26.51%,1.98
rental agreement andhra pradesh,22,82,26.83%,2.79
make offer letter,22,81,27.16%,3.46
experience letter maker online,22,40,55%,1
rent agreement near me,21,1580,1.33%,10.15
importance of partnership deed,21,1480,1.42%,8.09
online marriage certificate,21,1461,1.44%,26.82
shop rent agreement format,21,520,4.04%,5.86
bhada karar gujarati,21,330,6.36%,4.88
భూమి విక్రయ పత్రం,21,286,7.34%,6.45
asanify free offer letter,21,256,8.2%,3.7
will validity after death,21,249,8.43%,3.06
sale letter for vehicle download,21,240,8.75%,9.14
can a muslim man marry without consent of first wife,21,164,12.8%,2.2
importance of writing a will,21,161,13.04%,5.22
online rent agreement punjab,21,96,21.88%,2.17
rent agreement online haryana,21,87,24.14%,2.06
online work experience certificate,21,81,25.93%,1.64
offer letter create,21,79,26.58%,2.35
offer letter maker online,21,76,27.63%,2.76
rental agreement format andhra pradesh,21,50,42%,2.44
rent agreement format gujarat,21,48,43.75%,1.25
rent agreement maharashtra,20,2294,0.87%,9.07
rental agreement online free,20,1204,1.66%,8.08
power of attorney in india,20,931,2.15%,9.64
how to take divorce from husband in india,20,815,2.45%,5.26
karnataka marriage registration,20,735,2.72%,8.05
petition for divorce,20,705,2.84%,5.38
relieving letter pdf,20,575,3.48%,7.39
documents required for will registration,20,448,4.46%,6.29
difference between notary and registration,20,396,5.05%,4.45
how to apply marriage certificate in punjab,20,343,5.83%,6.5
haryana resident certificate apply online,20,318,6.29%,5.51
mcchandigarh.gov.in birth certificate,20,250,8%,6.56
car sale agreement format india,20,192,10.42%,6.42
apply marriage certificate online karnataka,20,166,12.05%,5.7
what happens when power of attorney holder dies,20,156,12.82%,3.46
what is the difference between relieving letter and experience letter,20,151,13.25%,2.86
rent agreement format in punjabi language,20,149,13.42%,5.13
time limit for execution of will in india,20,147,13.61%,3.05
job offer letter generator,20,133,15.04%,3.58
apply for marriage certificate online karnataka,20,114,17.54%,6.03
online rent agreement madhya pradesh,20,71,28.17%,2.03
rent agreement in gujarat,20,65,30.77%,1.31
house rent agreement format in west bengal,20,58,34.48%,2.03
create relieving letter online,20,39,51.28%,1
how to take divorce in india,19,893,2.13%,6.46
odisha marriage certificate,19,875,2.17%,8.36
punishment for second marriage without divorce in hindu,19,785,2.42%,5.34
uttarakhand birth certificate,19,667,2.85%,9.26
registered rent agreement,19,607,3.13%,14.01
download birth certificate online,19,599,3.17%,8.44
how to get fake experience certificate,19,527,3.61%,7.91
divorce process india,19,391,4.86%,6.7
apply for marriage certificate punjab,19,256,7.42%,5.54
time limit for challenging a will,19,245,7.76%,7.49
how to get caste certificate online,19,221,8.6%,7.83
validity of will,19,214,8.88%,24.64
રેન્ટ એગ્રીમેન્ટ ગુજરાતી,19,202,9.41%,3.94
token amount receipt format,19,158,12.03%,3.11
unregistered will validity in india,19,122,15.57%,3.01
fake offer letter generator free india,19,101,18.81%,2.8
online rent agreement jaipur,19,87,21.84%,2
rent agreement bhubaneswar,19,80,23.75%,1
rajasthan rent agreement,19,79,24.05%,1.46
rent agreement haryana online,19,76,25%,2.03
obc eligibility in ap,19,43,44.19%,1
relieving letter generator free,19,41,46.34%,1
mutual divorce process in india,18,2091,0.86%,9.2
experience certificate format,18,1658,1.09%,22.31
marriage certificate online mumbai,18,1285,1.4%,10.02
marriage registration odisha,18,1207,1.49%,8.45
marriage certificate online karnataka documents required,18,804,2.24%,7.67
jharkhand marriage certificate,18,701,2.57%,8.7
conditional will,18,470,3.83%,12.25
generate rent agreement online,18,461,3.9%,5.97
second marriage without divorce is legal,18,409,4.4%,3.2
obc certificate download ap,18,333,5.41%,8.24
income certificate validity in uttar pradesh,18,325,5.54%,2
muslim second marriage rules in india,18,239,7.53%,4.88
wife share in husband property after divorce,18,196,9.18%,3.89
time limit for challenging a will in india,18,163,11.04%,3.93
fake appointment letter maker,18,150,12%,3.6
how many days it takes to get caste certificate in uttar pradesh,18,137,13.14%,1.02
divorce filing in india,18,127,14.17%,4.1
does power of attorney need to be registered in india,18,122,14.75%,3.25
duplicate offer letter,18,119,15.13%,3.57
download rent agreement online maharashtra,18,114,15.79%,3.63
rent agreement format in gujarati word,18,98,18.37%,8.14
how to make caste certificate online,18,97,18.56%,6.95
up rent agreement,18,91,19.78%,2.48
fake offer letter creator,18,73,24.66%,2.73
online rent agreement west bengal,18,72,25%,2.19
online rent agreement bihar,18,60,30%,1.45
gujarat rent agreement,18,54,33.33%,1
how to take divorce,17,2202,0.77%,7.47
car sale agreement,17,1398,1.22%,29.86
work from home application,17,1395,1.22%,10.01
land agreement format,17,1044,1.63%,9.37
eviction notice to tenant,17,871,1.95%,8.83
india typing experience certificate,17,683,2.49%,11.24
