Top queries,Clicks,Impressions,CTR,Position
sale deed format for vehicle,17,529,3.21%,7.45
online rent agreement gurgaon,17,523,3.25%,7.87
limitation to challenge registered will,17,467,3.64%,8.44
cheque bounce notice format,17,454,3.74%,11.61
how to apply marriage certificate in odisha,17,393,4.33%,6.18
land sale agreement format,17,375,4.53%,9.69
importance of will,17,334,5.09%,6.16
business transfer agreement format,17,317,5.36%,9.87
online agreement download,17,279,6.09%,6.18
how to get marriage certificate in odisha,17,238,7.14%,6.15
filing for divorce in india,17,235,7.23%,6.24
cook experience certificate online apply,17,224,7.59%,5.06
token advance receipt format,17,218,7.8%,4.14
token money agreement for property pdf,17,112,15.18%,3.38
rent agreement online mp,17,105,16.19%,2.17
conditional will example,17,104,16.35%,3.94
how to make a fake offer letter,17,96,17.71%,5.05
shop rent agreement format in west bengal,17,87,19.54%,2.21
make fake offer letter,17,82,20.73%,2.91
make a offer letter,17,73,23.29%,3.34
rent agreement online punjab,17,60,28.33%,2.03
rent agreement up,17,59,28.81%,2.05
job offer letter maker online,17,54,31.48%,2.31
rent agreement download online,17,52,32.69%,3.33
gujarat rent agreement online,17,45,37.78%,1.02
maharashtra rent agreement,16,2408,0.66%,8.89
importance of a will,16,1463,1.09%,31.63
sale deed for vehicle,16,1389,1.15%,7.38
documents required for marriage certificate,16,1103,1.45%,37.39
apply for marriage certificate,16,933,1.71%,26.74
experience certificate pdf,16,839,1.91%,8.97
haryana resident certificate online check,16,514,3.11%,8.51
how to file for a divorce in india,16,366,4.37%,4.67
property rights of wife after divorce in india 2022,16,295,5.42%,4.08
registry marriage process,16,284,5.63%,7.6
கடை வாடகை ஒப்பந்த பத்திரம் pdf,16,276,5.8%,7.85
online domicile certificate haryana,16,245,6.53%,7.39
vehicle sale affidavit pdf india,16,233,6.87%,10.16
validity of unregistered will,16,168,9.52%,2.93
rent agreement format in bihar,16,166,9.64%,4.56
marriage certificate odisha apply online,16,146,10.96%,5.58
token payment receipt format for property,16,122,13.11%,2.76
second marriage in muslim law,16,119,13.45%,3.38
file divorce in india,16,119,13.45%,10.09
sample legal notice for consumer complaint,16,114,14.04%,5.92
generate offer letter,16,109,14.68%,3.47
sale deed for vehicle pdf,16,109,14.68%,5.06
stamp paper for rent agreement in punjab,16,90,17.78%,1.77
how to make fake work experience certificate,16,89,17.98%,3.69
make joining letter,16,87,18.39%,1.83
joining bonus letter format,16,86,18.6%,5.34
job offer letter maker,16,80,20%,3.11
rent agreement jaipur,16,79,20.25%,3.78
how to make central caste certificate,16,79,20.25%,5.22
rent agreement punjab,16,76,21.05%,2.66
file for divorce in india,16,73,21.92%,2.81
make a experience certificate,16,68,23.53%,2.69
property sale token receipt format,16,60,26.67%,2.92
make experience letter,16,50,32%,1.9
rent agreement online uttar pradesh,16,40,40%,1.75
experience letter online free,16,32,50%,1.09
procedure for divorce in india,15,2174,0.69%,9.07
evidence needed to contest a will,15,1061,1.41%,34.43
rent agreement stamp duty in up,15,874,1.72%,7.5
how to apply divorce in india,15,615,2.44%,5.66
reasons for second marriage in islam,15,503,2.98%,6.22
can wife claim husband property after divorce in india,15,433,3.46%,6.81
cost of making a will in india,15,430,3.49%,3.89
registered will validity supreme court,15,426,3.52%,10.44
does a man need permission to marry a second wife islam,15,414,3.62%,5.15
second wife islam,15,386,3.89%,7.55
plot sale agreement format pdf,15,300,5%,9.66
uttarakhand caste certificate,15,289,5.19%,6.52
company not giving relieving letter,15,287,5.23%,5.01
apply marriage certificate online odisha,15,273,5.49%,6.24
rent agreement stamp duty in mp,15,265,5.66%,3.12
online rental agreement hyderabad,15,243,6.17%,5.51
edit offer letter online,15,240,6.25%,4.78
filing divorce in india,15,196,7.65%,7.03
what is relieving letter and experience letter,15,189,7.94%,2.84
online rent agreement generator,15,185,8.11%,4.56
medical certificate form 1a pdf,15,183,8.2%,3.75
who has power of attorney after death if there is no will,15,172,8.72%,7.16
how to register power of attorney in india,15,166,9.04%,5.08
car sale letter pdf download,15,157,9.55%,8.03
documents required for marriage certificate in odisha,15,155,9.68%,4.35
consumer legal notice format,15,150,10%,5.85
token money receipt format download,15,136,11.03%,3.1
rent agreement create online,15,134,11.19%,6.07
fake hotel experience certificate,15,129,11.63%,2.52
rental agreement online hyderabad,15,126,11.9%,5.21
vehicle sale agreement india,15,117,12.82%,5.27
documents required for rent agreement in gujarat,15,116,12.93%,4.07
token money agreement format,15,107,14.02%,4.28
make offer letter online free,15,104,14.42%,3.29
marriage certificate uttarakhand documents required,15,103,14.56%,2.94
will validity in india,15,101,14.85%,2.95
how to get fake offer letter,15,100,15%,4.74
what is the difference between experience letter and relieving letter,15,99,15.15%,2.81
how to create a experience certificate,15,98,15.31%,3.76
token money for property receipt format,15,97,15.46%,3.05
rent agreement stamp paper in rajasthan,15,95,15.79%,1.55
bhada karar format,15,95,15.79%,5.84
maharashtra rent agreement download,15,71,21.13%,3.27
bengali rent agreement format,15,55,27.27%,2.55
sample rent agreement maharashtra,15,53,28.3%,2.32
how to create relieving letter,15,53,28.3%,4.64
mutual divorce procedure,14,3750,0.37%,9.68
process of divorce in india,14,1545,0.91%,9.1
how to file for divorce,14,1532,0.91%,8.65
offer letter format,14,1378,1.02%,42.08
second marriage registration without mentioning divorce,14,1102,1.27%,8.2
is second marriage legal in india,14,888,1.58%,5.36
second wife in islam,14,666,2.1%,5.83
bhada karar,14,497,2.82%,6.73
how to take divorce from wife in india,14,402,3.48%,4.45
rent agreement document,14,320,4.38%,7.24
rental agreement generator,14,288,4.86%,5.93
rent agreement online gurgaon,14,270,5.19%,7.11
marriage certificate online karnataka download,14,252,5.56%,7.35
2nd wife in islam,14,245,5.71%,4.92
can wife claim husband property during divorce,14,227,6.17%,10.42
token receipt,14,210,6.67%,2.93
foco model franchise agreement pdf,14,194,7.22%,5.77
how to apply for marriage certificate in punjab,14,187,7.49%,5.98
marriage registration online punjab,14,169,8.28%,5.55
difference between experience and relieving letter,14,165,8.48%,2.85
token agreement format,14,163,8.59%,3.63
how to make fake certificate of employment,14,160,8.75%,4.84
relieving letter and experience letter difference,14,155,9.03%,2.97
rent agreement haryana,14,144,9.72%,3.3
apply for divorce in india,14,142,9.86%,5.22
importance of creating a will,14,125,11.2%,4.45
apply domicile online,14,124,11.29%,7.97
rent agreement format chandigarh pdf,14,121,11.57%,3.66
rent agreement kolkata,14,120,11.67%,4.03
download land sale agreement form,14,118,11.86%,9.36
punishment for second marriage without divorce in islam,14,111,12.61%,1.92
online experience certificate maker free,14,110,12.73%,6.08
car sale deed pdf,14,107,13.08%,5.2
job offer letter generator free,14,81,17.28%,4.15
flat token money receipt format,14,73,19.18%,2.73
driving license correction form,14,73,19.18%,5.59
commercial rent agreement online,14,72,19.44%,3.38
punjab rent agreement,14,63,22.22%,2.46
rent agreement format in maharashtra,14,62,22.58%,2.61
how to register marriage in uttarakhand,14,58,24.14%,3.91
rent agreement odisha,14,57,24.56%,1.96
leave and license agreement online download,14,56,25%,4.61
rent agreement madhya pradesh,14,46,30.43%,2
experience letter online editor,14,34,41.18%,1
create a experience certificate,14,21,66.67%,1.05
mutual divorce process,13,3370,0.39%,10.23
marriage registration haryana,13,1031,1.26%,9.99
bmc marriage registration,13,1025,1.27%,7.34
income certificate validity in up,13,619,2.1%,4.83
11-month rental agreement stamp paper value,13,509,2.55%,7.72
how to get divorce in india from husband,13,460,2.83%,5.42
obc application form,13,457,2.84%,9.08
india divorce process,13,389,3.34%,6.39
rent agreement stamp duty,13,380,3.42%,24.42
vehicle selling agreement,13,363,3.58%,9.23
rights of wife after divorce in india,13,360,3.61%,6.63
token money receipt format in word,13,355,3.66%,8.74
ભાડા કરાર pdf,13,343,3.79%,8.55
odisha marriage registration form,13,341,3.81%,7.95
marriage certificate punjab documents required,13,325,4%,7.21
two wheeler sale agreement,13,295,4.41%,7.65
haryana domicile certificate online,13,248,5.24%,7.29
online work experience certificate maker,13,244,5.33%,7.31
crsorgi.gov.in birth certificate uttarakhand,13,232,5.6%,4.78
rent agreement price,13,228,5.7%,5.72
fake rental agreement online,13,214,6.07%,4.57
relieving letter or experience letter,13,199,6.53%,2.9
conditions to marry a second husband in islam,13,183,7.1%,3.85
uttarakhand birth certificate online apply,13,178,7.3%,5.47
franchise agreement sample in india pdf,13,174,7.47%,8.25
registered will charges,13,171,7.6%,3.73
obc caste list in ap,13,165,7.88%,6.58
vehicle sale letter pdf,13,160,8.12%,8.77
is it necessary to take permission for second marriage in islam,13,150,8.67%,4.59
ભાડા કરાર ના નિયમો,13,142,9.15%,4.8
birth certificate uttarakhand online,13,137,9.49%,7.35
in islam do you need your wife's permission to marry again,13,136,9.56%,1.74
fake offer letter format,13,123,10.57%,5.59
create appointment letter online free,13,121,10.74%,2.55
marrying second wife in islam,13,120,10.83%,4.02
download rent agreement,13,120,10.83%,7.31
uttarakhand caste certificate documents required,13,119,10.92%,3.36
experience certificate and relieving letter,13,114,11.4%,2.82
how to make birth certificate in uttarakhand,13,106,12.26%,4.03
registered rent agreement in up,13,104,12.5%,4.05
online bhada karar registration,13,103,12.62%,5.41
rent agreement in up,13,80,16.25%,3.04
11 months rental agreement format in bengali,13,78,16.67%,5.15
wife's right on husband's property after divorce,13,75,17.33%,3.76
how to apply for birth certificate in uttarakhand,13,69,18.84%,3.65
fake interview letter,13,69,18.84%,5.06
fake offer letter maker,13,66,19.7%,2.35
create offer letter free,13,66,19.7%,3.89
shop rent agreement pdf,13,52,25%,5.27
job offer letter creator,13,49,26.53%,2.88
reliving letter,12,4614,0.26%,1.46
how to get divorce from husband,12,1503,0.8%,8.93
land agreement,12,958,1.25%,11.22
caste certificate,12,763,1.57%,10.21
does a muslim man need permission to marry a second wife,12,749,1.6%,5.56
mumbai municipal corporation marriage certificate,12,502,2.39%,6.53
land agreement paper,12,492,2.44%,6.15
will in india,12,470,2.55%,6.94
chandigarh birth certificate,12,469,2.56%,7.17
rental agreement form,12,431,2.78%,7.28
how to divorce in india,12,390,3.08%,5.61
registered rent agreement cost,12,388,3.09%,22.24
marriage certificate download karnataka,12,384,3.12%,8.65
online marriage certificate bangalore,12,376,3.19%,7.8
haryana marriage registration fees,12,335,3.58%,5.38
medical certificate form 1a,12,277,4.33%,6.08
sample rent agreement,12,271,4.43%,8.08
relieving letter and experience certificate,12,249,4.82%,3.08
divorce in india procedure,12,249,4.82%,5.24
vehicle lease agreement pdf india,12,223,5.38%,9.82
divorce lawyer online consultation,12,218,5.5%,7.06
sc certificate chandigarh,12,211,5.69%,5.1
registered will vs unregistered will,12,192,6.25%,5.82
duplicate experience certificate,12,185,6.49%,6.78
online rent agreement ahmedabad,12,182,6.59%,6.41
polygamy in islam,12,171,7.02%,5.08
marriage certificate download chandigarh,12,164,7.32%,7.18
shop rent agreement format pdf,12,163,7.36%,17.28
filing a divorce in india,12,154,7.79%,10.58
online marriage certificate punjab,12,150,8%,5.67
law for second marriage without divorce,12,143,8.39%,4.01
marriage certificate punjab online apply,12,134,8.96%,5.4
what is difference between relieving letter and experience letter,12,129,9.3%,2.88
legal notice format for consumer complaint,12,125,9.6%,4.88
online birth certificate chandigarh,12,122,9.84%,5.67
experience and relieving letter are same,12,110,10.91%,2.05
offer letter edit,12,103,11.65%,4.92
cheque bounce notice under section 138 format,12,99,12.12%,11.3
unregistered will validity in tamilnadu,12,95,12.63%,2.67
fees for partnership firm registration,12,93,12.9%,3.26
caste certificate online uttarakhand,12,90,13.33%,6.14
stamp duty on rent agreement in punjab,12,80,15%,1.12
make appointment letter online,12,78,15.38%,2.19
should power of attorney be registered,12,71,16.9%,3.49
create job offer letter,12,66,18.18%,4.5
stamp paper value for rent agreement in west bengal,12,64,18.75%,1.02
create an offer letter online,12,57,21.05%,2.75
rent agreement format in punjab,12,53,22.64%,2.02
rent agreement maharashtra format,12,52,23.08%,3.19
experience certificate creator,12,52,23.08%,3.94
appointment letter maker online,12,49,24.49%,2.51
download rent agreement maharashtra,12,48,25%,3.08
caste certificate making process,12,42,28.57%,5.76
court marriage process in uttarakhand,12,37,32.43%,1.62
eligibility for obc certificate,12,33,36.36%,5.3
rent agreement format odisha,12,29,41.38%,2
make relieving letter online,12,22,54.55%,1
eviction notice,11,1410,0.78%,9.08
marriage certificate apply online,11,1182,0.93%,28.21
uttarakhand marriage certificate,11,1168,0.94%,7.38
rc transfer online,11,870,1.26%,13.04
can a 16 year old fly alone without parents permission,11,848,1.3%,6.88
land purchase agreement,11,820,1.34%,27.12
vehicle lease agreement,11,687,1.6%,22.18
marriage certificate india online,11,682,1.61%,9.28
muslim marriage certificate online karnataka,11,669,1.64%,8.04
validity of income certificate in up,11,604,1.82%,4.9
agreement for sale of land,11,572,1.92%,10.8
house rental agreement format,11,563,1.95%,8.14
rent agreement gurgaon,11,545,2.02%,10.89
online divorce lawyer consultation,11,545,2.02%,11.18
experience letter template,11,499,2.2%,15.75
car sale deed format,11,490,2.24%,6.91
house rent agreement online,11,466,2.36%,9.39
documents required for marriage certificate in haryana,11,460,2.39%,5.33
notary rent agreement format pdf,11,445,2.47%,4.56
vehicle sale deed,11,429,2.56%,7.5
what to do if company is not accepting resignation in india,11,388,2.84%,8.77
ulb odisha marriage certificate,11,381,2.89%,9.15
how to get experience certificate without working,11,331,3.32%,6.9
marriage certificate online punjab,11,273,4.03%,5.75
what to do if company is not giving relieving letter,11,247,4.45%,4.78
marriage certificate in punjab,11,241,4.56%,5.34
birth certificate chandigarh download,11,241,4.56%,6.39
transfer of property through unregistered will,11,239,4.6%,6.04
rent agreement in vadodara,11,214,5.14%,5.23
bike sale agreement format pdf,11,214,5.14%,5.63
birth certificate punjab pdf,11,214,5.14%,6.28
how to get experience letter,11,208,5.29%,3.47
rental agreement format pdf india,11,207,5.31%,10.02
cheque bounce legal notice format,11,202,5.45%,11.44
notary vs registration,11,194,5.67%,4.47
legal notice for defective goods format,11,191,5.76%,8.93
haryana domicile apply online,11,188,5.85%,5.82
birth certificate online uttarakhand,11,187,5.88%,7.75
marriage certificate odisha documents,11,174,6.32%,5.14
ભાડા કરાર ફોર્મ,11,172,6.4%,3.59
rent agreement hyderabad,11,163,6.75%,5.98
rental agreement pdf,11,161,6.83%,17.36
karnataka marriage registration online,11,159,6.92%,6.22
flipkart experience certificate,11,154,7.14%,1.27
how to initiate divorce in india,11,145,7.59%,5.11
difference between relieving and experience letter,11,142,7.75%,2.74
how to download obc certificate online andhra pradesh,11,140,7.86%,5.95
car sale agreement pdf download,11,137,8.03%,8.88
partnership deed charges,11,131,8.4%,4.65
property rights of wife after divorce in india 2021,11,126,8.73%,3.34
e rent agreement,11,125,8.8%,6.47
house rent agreement format in bengali pdf,11,123,8.94%,8.81
free experience certificate generator,11,105,10.48%,4.37
concurrent wills,11,102,10.78%,3.48
validity of power of attorney after death of one of the principal,11,101,10.89%,5.4
bike sale agreement pdf,11,96,11.46%,5.99
marriage registration karnataka online,11,89,12.36%,6.34
hyderabad rental agreement sample,11,83,13.25%,3.48
file a divorce in india,11,81,13.58%,2.69
car lease agreement format india,11,80,13.75%,9.51
download rent agreement copy online,11,78,14.1%,3.4
is an unregistered will valid,11,72,15.28%,3.17
rent agreement kerala,11,69,15.94%,2.51
charges for will registration,11,68,16.18%,1.85
will challenge time limit,11,67,16.42%,4.69
rent agreement format gujarati,11,63,17.46%,5.32
rent agreement in rajasthan,11,61,18.03%,2.44
stamp duty for rent agreement in west bengal,11,60,18.33%,1
how to fill marriage certificate form,11,55,20%,8.36
duplicate rent agreement,11,53,20.75%,4.7
విడాకులు లేకుండా రెండవ వివాహం,11,51,21.57%,10.39
rent agreement format haryana,11,46,23.91%,2.87
how to apply central caste certificate,11,42,26.19%,3.95
legal notice draft for consumer complaint,11,31,35.48%,3.74
gujarati bhada karar,11,30,36.67%,3.03
work experience certificate maker online,11,29,37.93%,2.31
rental agreement near me,10,2272,0.44%,9.85
work experience certificate,10,1197,0.84%,16.49
procedure of divorce in india,10,783,1.28%,9.24
mcgm marriage certificate download,10,632,1.58%,10.05
marriage certificate documents,10,546,1.83%,36.06
how to register a will in india,10,501,2%,7.73
create rental agreement online,10,464,2.16%,9.07
rental agreement in hyderabad,10,381,2.62%,4.49
how to fill form no 25 for renewal of registration,10,365,2.74%,5.15
online birth certificate uttarakhand,10,361,2.77%,9.05
how to get work experience certificate without working,10,359,2.79%,7.33
bike selling agreement,10,354,2.82%,9.03
caste certificate apply online,10,337,2.97%,12.5
marriage certificate haryana fees,10,331,3.02%,5.01
how to give divorce to wife,10,299,3.34%,5.84
how to get marriage certificate online in karnataka,10,293,3.41%,6.97
can a woman do second marriage without divorce,10,281,3.56%,3.06
probate of unregistered will,10,276,3.62%,7.34
how to download registered rent agreement online,10,267,3.75%,7.14
how to apply for marriage certificate in odisha,10,255,3.92%,6.57
apply for marriage certificate odisha,10,241,4.15%,6.63
muslim second wife,10,231,4.33%,6.74
rent agreement paper,10,230,4.35%,5.79
how to apply for a divorce in india,10,223,4.48%,5.61
time limit to challenge a registered will in india,10,221,4.52%,5.68
registration of power of attorney,10,214,4.67%,12.4
do you need permission from first wife for second marriage in islam,10,203,4.93%,3.63
stamp paper for vehicle sale agreement pdf,10,201,4.98%,5.13
second marriage in islam hadith,10,182,5.49%,4.7
can a will be challenged after 20 years,10,182,5.49%,7.42
how to apply for caste certificate,10,175,5.71%,6.77
second marriage islam,10,172,5.81%,3.5
"undertaking stating the reasons for delay * [ in case marriage done before 
90 days from today ]",10,172,5.81%,7.26
how to make an experience certificate,10,160,6.25%,4.36
online court marriage registration in odisha,10,159,6.29%,6.75
validity of power of attorney after death of principal,10,158,6.33%,4.94
caste certificate chandigarh,10,144,6.94%,7.09
free experience certificate,10,133,7.52%,7.21
download birth certificate chandigarh online,10,125,8%,5.99
will cost in india,10,121,8.26%,3.77
legal notice for defective goods draft format,10,119,8.4%,8.24
land sale agreement form pdf,10,115,8.7%,10.87
car sale agreement pdf,10,112,8.93%,10.02
notarized vs registered agreement,10,107,9.35%,3.93
dummy offer letter,10,107,9.35%,4.75
online rent agreement format,10,106,9.43%,7.32
can wife claim husband property,10,106,9.43%,7.49
birth certificate uttarakhand documents required,10,101,9.9%,3.56
will validity,10,95,10.53%,7.2
petition of divorce,10,94,10.64%,3.02
documents required for caste certificate in uttarakhand,10,92,10.87%,3.04
limitation for challenging will,10,90,11.11%,5.19
will execution time limit,10,88,11.36%,3.52
car sale agreement in urdu pdf,10,88,11.36%,9.19
can a muslim man marry a second wife without permission,10,84,11.9%,3.51
rent agreement stamp paper value in kerala,10,82,12.2%,2.51
land sale agreement form pdf download,10,78,12.82%,8.78
how to file for divorce india,10,77,12.99%,3.81
will charges in india,10,69,14.49%,3.17
duplicate will,10,67,14.93%,2.34
apply domicile online haryana,10,67,14.93%,5.18
kerala rent agreement format,10,65,15.38%,3.88
house rent agreement format in gujarati,10,64,15.62%,7.62
apply for marriage certificate karnataka,10,62,16.13%,6.19
rental agreement in andhra pradesh,10,60,16.67%,2.32
blogging competition,10,60,16.67%,6.25
documents required for will,10,58,17.24%,3.17
offer letter editor online,10,56,17.86%,3.34
offer letter fake,10,56,17.86%,4.7
making experience certificate,10,55,18.18%,2.31
land sale purchase agreement,10,50,20%,6.14
file for divorce india,10,37,27.03%,2.65
rent agreement stamp duty in punjab,10,35,28.57%,1
bhada karar in gujarati format,10,33,30.3%,4.06
documents required for category certificate,10,31,32.26%,3.58
divorce filing india,10,27,37.04%,2.63
online joining letter,10,26,38.46%,1.58
rent agreement format in odisha,10,26,38.46%,2.85
experience certificate online editor,10,25,40%,2.16
relieve letter,9,3015,0.3%,2.14
rc transfer,9,2382,0.38%,11.12
partnership deed,9,1342,0.67%,28.77
can 17 year olds fly alone,9,1171,0.77%,9.87
divorce procedure,9,1163,0.77%,16.01
what is the process of divorce in india,9,997,0.9%,9.28
power of attorney after death,9,753,1.2%,57.33
marriage certificate haryana documents,9,715,1.26%,7.24
rent deed format,9,565,1.59%,10.21
how to make offer letter,9,487,1.85%,8.93
download experience certificate,9,460,1.96%,8.61
unprivileged will,9,454,1.98%,8.59
death certificate chandigarh,9,444,2.03%,6.99
experience letter pdf,9,384,2.34%,9.38
stamp duty on rent agreement,9,360,2.5%,24.61
rights of a woman in divorce in india,9,338,2.66%,15.87
residence certificate,9,330,2.73%,7.01
documents required for caste certificate,9,319,2.82%,10.77
franchise agreement pdf,9,312,2.88%,15.33
application for work from home,9,300,3%,12.14
ap obc certificate,9,298,3.02%,7.41
in how many days caste certificate is made,9,296,3.04%,4.64
car sale deed,9,277,3.25%,8.42
first wife upset with husband second marriage in islam,9,272,3.31%,8.45
car sell agreement,9,271,3.32%,10.07
divorce procedure india,9,270,3.33%,6.82
bike sale deed format,9,266,3.38%,7.29
rent agreement charges,9,255,3.53%,5.51
form d memorandum of marriage,9,254,3.54%,8.61
marriage certificate online uttarakhand,9,251,3.59%,7.04
startup investor agreement template,9,246,3.66%,10.07
document required for marriage certificate,9,234,3.85%,19.34
bike sale agreement format,9,230,3.91%,7.55
token amount agreement format,9,222,4.05%,4.82
does power of attorney need to be registered,9,219,4.11%,4.22
chandigarh birth certificate download,9,215,4.19%,6.56
sale letter for car pdf,9,207,4.35%,9.01
motor vehicle sale agreement,9,196,4.59%,12.27
internship relieving letter,9,194,4.64%,5.91
marriage certificate documents list haryana,9,193,4.66%,5.63
car sell letter pdf,9,193,4.66%,9.05
haryana domicile online,9,192,4.69%,6.34
rental agreement stamp paper value,9,187,4.81%,4.25
ભાડા કરાર,9,176,5.11%,4.75
uttarakhand obc certificate,9,176,5.11%,7.1
bike sale deed format pdf,9,173,5.2%,4.86
rent agreement cost,9,163,5.52%,6.88
દુકાન ભાડા કરાર નમુનો pdf,9,162,5.56%,10.02
obc certificate uttarakhand,9,160,5.62%,6.28
bike sell agreement,9,159,5.66%,8.23
second marriage in islam without permission of first wife india,9,156,5.77%,2.72
are relieving and experience letter same,9,156,5.77%,3.01
land selling agreement,9,154,5.84%,6.14
online rental agreement generator,9,153,5.88%,5.2
sample letter to extend payment terms with suppliers,9,148,6.08%,9.74
experience letter download,9,141,6.38%,6.24
sale of vehicle agreement,9,141,6.38%,12.6
simple business transfer agreement format,9,140,6.43%,7.02
bike sell agreement format,9,139,6.47%,7.38
kaveri online marriage registration,9,113,7.96%,6
how to apply caste certificate online,9,113,7.96%,13.65
second marriage law in pakistan,9,112,8.04%,2.35
can husband marry without divorce,9,105,8.57%,3.29
driving licence correction form,9,102,8.82%,5.12
can unregistered will be challenged,9,95,9.47%,3.14
llp deed download,9,94,9.57%,7.55
haryana domicile online apply,9,93,9.68%,5.46
documents required for marriage certificate in uttarakhand,9,89,10.11%,2.91
create an offer letter,9,86,10.47%,6.93
how to generate offer letter,9,82,10.98%,3.61
divorce application in india,9,81,11.11%,4.43
haryana domicile certificate apply online,9,79,11.39%,5.33
how to make fake appointment letter,9,74,12.16%,4.3
partnership dissolution agreement format india,9,73,12.33%,7.3
rules for second marriage in islam,9,71,12.68%,3.11
how to start a startup company in india,9,70,12.86%,2.01
commercial rent agreement in gujarati,9,70,12.86%,5.77